{
  "schemaVersion": 4,
  "milestone": "M1",
  "createdAt": "2026-09-30T09:22:55.124Z",
  "env": {
    "macOS": "27.2",
    "safari": "27.2",
    "chip": "Apple M1 Pro",
    "display": "Liquid Retina XDR",
    "power": "ac",
    "sdrBrightness": "mid",
    "refreshRate": "60hz",
    "windowMode": "fullscreen",
    "ua": "Mozilla/5.0 (Macintosh; Intel Mac OS X 10_15_7) AppleWebKit/605.1.15 (KHTML, like Gecko) Version/27.2 Safari/605.1.15",
    "screen": {
      "width": 1800,
      "height": 1169,
      "availWidth": 1741,
      "availHeight": 1129,
      "dpr": 2,
      "colorDepth": 24
    }
  },
  "api": {
    "secureContext": true,
    "navigatorGpu": true,
    "adapter": {
      "features": [
        "bgra8unorm-storage",
        "clip-distances",
        "core-features-and-limits",
        "depth-clip-control",
        "depth32float-stencil8",
        "float16-renderable",
        "float32-blendable",
        "float32-filterable",
        "float32-renderable",
        "indirect-first-instance",
        "primitive-index",
        "rg11b10ufloat-renderable",
        "shader-f16",
        "texture-compression-astc",
        "texture-compression-astc-sliced-3d",
        "texture-compression-bc",
        "texture-compression-bc-sliced-3d",
        "texture-compression-etc2",
        "texture-formats-tier1",
        "texture-formats-tier2",
        "timestamp-query"
      ],
      "vendor": "apple",
      "architecture": "apple",
      "device": "apple",
      "description": "apple"
    },
    "timestampQuery": true,
    "preferredFormat": "bgra8unorm",
    "configure": {
      "ok": true,
      "error": null
    },
    "getConfiguration": {
      "supported": true,
      "format": "rgba16float",
      "colorSpace": "display-p3",
      "toneMappingMode": "extended",
      "error": null
    },
    "mediaQueries": {
      "dynamicRangeHigh": true,
      "colorGamutP3": true
    },
    "canvas2dFloat16": {
      "supported": false,
      "colorType": null,
      "error": null
    },
    "webgl": {
      "webgl2": true,
      "drawingBufferStorage": false,
      "error": null
    },
    "batteryApi": false
  },
  "edr": {
    "maxDistinctStep": 3,
    "encodingMatch": "nonlinear",
    "refHdrImage": "not_checked",
    "secondsSinceDraw": 2
  },
  "perf": {
    "srcRes": "3840x2160",
    "canvasRes": "3600x2025",
    "fps": 56.14,
    "dropRate": 0.065,
    "jsP50": 0,
    "jsP95": 1,
    "g3": {
      "1920x1080": {
        "baselineMiss": 0,
        "itmMiss": 0,
        "delta": 0,
        "rvfcMiss": 0.31833,
        "loopFps": 120,
        "videoPresentedFps": 55.9,
        "jsP95Max": 1,
        "gpuMsMax": 1.756
      },
      "3840x2160": {
        "baselineMiss": 0,
        "itmMiss": 0,
        "delta": 0,
        "rvfcMiss": 0.11204,
        "loopFps": 120.01,
        "videoPresentedFps": 56.9,
        "jsP95Max": 1,
        "gpuMsMax": 2.933
      }
    },
    "visualJudder": "none",
    "runs": [
      {
        "fixture": "ramp-1080p60",
        "mode": "R0",
        "driver": "raf",
        "layout": "overlay",
        "itm": false,
        "srcRes": "1920x1080",
        "canvasRes": null,
        "fullscreen": true,
        "frames": 1291,
        "durationSec": 11,
        "warmupSec": 1,
        "windowSec": 9.99,
        "windowFrames": 1200,
        "fps": 117.35,
        "dropRate": 0.10833,
        "dropRatePresented": 0.00743,
        "missRate": 0,
        "loopFps": 120,
        "videoPresentedFps": 53.98,
        "jsP50": 0,
        "jsP95": 0,
        "jsMax": 1,
        "gpuMs": null,
        "gpuSamples": 0,
        "videoQuality": {
          "dropped": 0,
          "total": 0
        }
      },
      {
        "fixture": "ramp-1080p60",
        "mode": "R2",
        "driver": "raf",
        "layout": "overlay",
        "itm": false,
        "srcRes": "1920x1080",
        "canvasRes": "1920x1080",
        "fullscreen": true,
        "frames": 1319,
        "durationSec": 11,
        "warmupSec": 1,
        "windowSec": 10,
        "windowFrames": 1200,
        "fps": 119.9,
        "dropRate": 0.07833,
        "dropRatePresented": 0.00898,
        "missRate": 0.00167,
        "loopFps": 119.9,
        "videoPresentedFps": 55.9,
        "jsP50": 0,
        "jsP95": 1,
        "jsMax": 5,
        "gpuMs": 1.596,
        "gpuSamples": 120,
        "videoQuality": {
          "dropped": 0,
          "total": 1
        }
      },
      {
        "fixture": "ramp-1080p60",
        "mode": "R3",
        "driver": "raf",
        "layout": "overlay",
        "itm": true,
        "srcRes": "1920x1080",
        "canvasRes": "1920x1080",
        "fullscreen": true,
        "frames": 1321,
        "durationSec": 11,
        "warmupSec": 1,
        "windowSec": 10,
        "windowFrames": 1201,
        "fps": 120.09,
        "dropRate": 0.08486,
        "dropRatePresented": 0.01613,
        "missRate": 0,
        "loopFps": 120,
        "videoPresentedFps": 55.9,
        "jsP50": 0,
        "jsP95": 1,
        "jsMax": 8,
        "gpuMs": 1.656,
        "gpuSamples": 120,
        "videoQuality": {
          "dropped": 0,
          "total": 0
        }
      },
      {
        "fixture": "ramp-1080p60",
        "mode": "V3",
        "driver": "rvfc",
        "layout": "overlay",
        "itm": true,
        "srcRes": "1920x1080",
        "canvasRes": "1920x1080",
        "fullscreen": true,
        "frames": 594,
        "durationSec": 11,
        "warmupSec": 1,
        "windowSec": 9.98,
        "windowFrames": 539,
        "fps": 54,
        "dropRate": 0.10167,
        "dropRatePresented": 0.02004,
        "missRate": 0.31833,
        "loopFps": 53.89,
        "videoPresentedFps": 54.99,
        "jsP50": 0,
        "jsP95": 1,
        "jsMax": 5,
        "gpuMs": 1.756,
        "gpuSamples": 54,
        "videoQuality": {
          "dropped": 0,
          "total": 0
        }
      },
      {
        "fixture": "ramp-2160p60",
        "mode": "R0",
        "driver": "raf",
        "layout": "overlay",
        "itm": false,
        "srcRes": "3840x2160",
        "canvasRes": null,
        "fullscreen": true,
        "frames": 1321,
        "durationSec": 11,
        "warmupSec": 1,
        "windowSec": 10,
        "windowFrames": 1201,
        "fps": 120.09,
        "dropRate": 0.07,
        "dropRatePresented": 0.01066,
        "missRate": 0,
        "loopFps": 120,
        "videoPresentedFps": 56.41,
        "jsP50": 0,
        "jsP95": 0,
        "jsMax": 1,
        "gpuMs": null,
        "gpuSamples": 0,
        "videoQuality": {
          "dropped": 0,
          "total": 0
        }
      },
      {
        "fixture": "ramp-2160p60",
        "mode": "R2",
        "driver": "raf",
        "layout": "overlay",
        "itm": false,
        "srcRes": "3840x2160",
        "canvasRes": "3600x2025",
        "fullscreen": true,
        "frames": 1319,
        "durationSec": 11,
        "warmupSec": 1,
        "windowSec": 10,
        "windowFrames": 1200,
        "fps": 119.91,
        "dropRate": 0.07,
        "dropRatePresented": 0.0159,
        "missRate": 0.00167,
        "loopFps": 119.9,
        "videoPresentedFps": 56.79,
        "jsP50": 0,
        "jsP95": 1,
        "jsMax": 7,
        "gpuMs": 1.961,
        "gpuSamples": 120,
        "videoQuality": {
          "dropped": 0,
          "total": 1
        }
      },
      {
        "fixture": "ramp-2160p60",
        "mode": "R3",
        "driver": "raf",
        "layout": "overlay",
        "itm": true,
        "srcRes": "3840x2160",
        "canvasRes": "3600x2025",
        "fullscreen": true,
        "frames": 1321,
        "durationSec": 11.01,
        "warmupSec": 1,
        "windowSec": 9.99,
        "windowFrames": 1200,
        "fps": 119.99,
        "dropRate": 0.05833,
        "dropRatePresented": 0.00704,
        "missRate": 0,
        "loopFps": 120.01,
        "videoPresentedFps": 56.9,
        "jsP50": 0,
        "jsP95": 1,
        "jsMax": 10,
        "gpuMs": 2.373,
        "gpuSamples": 120,
        "videoQuality": {
          "dropped": 0,
          "total": 0
        }
      },
      {
        "fixture": "ramp-2160p60",
        "mode": "V3",
        "driver": "rvfc",
        "layout": "overlay",
        "itm": true,
        "srcRes": "3840x2160",
        "canvasRes": "3600x2025",
        "fullscreen": true,
        "frames": 618,
        "durationSec": 11.01,
        "warmupSec": 1,
        "windowSec": 9.97,
        "windowFrames": 561,
        "fps": 56.14,
        "dropRate": 0.065,
        "dropRatePresented": 0.00356,
        "missRate": 0.11204,
        "loopFps": 56.19,
        "videoPresentedFps": 56.39,
        "jsP50": 0,
        "jsP95": 1,
        "jsMax": 4,
        "gpuMs": 2.933,
        "gpuSamples": 56,
        "videoQuality": {
          "dropped": 0,
          "total": 0
        }
      }
    ],
    "gpuMs": 2.933
  },
  "flags": {
    "drm": false,
    "hdrSource": false,
    "fullscreen": true
  },
  "errors": []
}