{
  "schemaVersion": 1,
  "milestone": "M1",
  "createdAt": "2026-09-30T08:10:13.042Z",
  "env": {
    "macOS": "27.2",
    "safari": "27.2",
    "chip": "Apple M1 Pro",
    "display": "Liquid Retina XDR",
    "power": null,
    "sdrBrightness": null,
    "windowMode": null,
    "ua": "Mozilla/5.0 (Macintosh; Intel Mac OS X 10_15_7) AppleWebKit/605.1.15 (KHTML, like Gecko) Version/27.2 Safari/605.1.15",
    "screen": {
      "width": 1800,
      "height": 1169,
      "availWidth": 1740,
      "availHeight": 1129,
      "dpr": 2,
      "colorDepth": 24
    }
  },
  "api": {
    "secureContext": true,
    "navigatorGpu": true,
    "adapter": {
      "features": [
        "bgra8unorm-storage",
        "clip-distances",
        "core-features-and-limits",
        "depth-clip-control",
        "depth32float-stencil8",
        "float16-renderable",
        "float32-blendable",
        "float32-filterable",
        "float32-renderable",
        "indirect-first-instance",
        "primitive-index",
        "rg11b10ufloat-renderable",
        "shader-f16",
        "texture-compression-astc",
        "texture-compression-astc-sliced-3d",
        "texture-compression-bc",
        "texture-compression-bc-sliced-3d",
        "texture-compression-etc2",
        "texture-formats-tier1",
        "texture-formats-tier2",
        "timestamp-query"
      ],
      "vendor": "apple",
      "architecture": "apple",
      "device": "apple",
      "description": "apple"
    },
    "timestampQuery": true,
    "preferredFormat": "bgra8unorm",
    "configure": {
      "ok": true,
      "error": null
    },
    "getConfiguration": {
      "supported": true,
      "format": "rgba16float",
      "colorSpace": "display-p3",
      "toneMappingMode": "extended",
      "error": null
    },
    "mediaQueries": {
      "dynamicRangeHigh": true,
      "colorGamutP3": true
    },
    "canvas2dFloat16": {
      "supported": false,
      "colorType": null,
      "error": null
    },
    "webgl": {
      "webgl2": true,
      "drawingBufferStorage": false,
      "error": null
    },
    "batteryApi": false
  },
  "edr": {
    "maxDistinctStep": 4,
    "encodingMatch": null,
    "refHdrImage": "not_checked"
  },
  "perf": {
    "srcRes": null,
    "canvasRes": null,
    "fps": null,
    "dropRate": null,
    "jsP50": null,
    "jsP95": null,
    "runs": []
  },
  "flags": {
    "drm": false,
    "hdrSource": false,
    "fullscreen": false
  },
  "errors": []
}