{
  "schemaVersion": 5,
  "milestone": "M1",
  "createdAt": "2026-10-01T01:19:00.295Z",
  "env": {
    "macOS": "27.2",
    "safari": "27.2",
    "chip": "Apple M1 Pro",
    "display": "Liquid Retina XDR",
    "power": "ac",
    "sdrBrightness": "mid",
    "refreshRate": "60hz",
    "windowMode": null,
    "ua": "Mozilla/5.0 (Macintosh; Intel Mac OS X 10_15_7) AppleWebKit/605.1.15 (KHTML, like Gecko) Version/27.2 Safari/605.1.15",
    "screen": {
      "width": 1800,
      "height": 1169,
      "availWidth": 1744,
      "availHeight": 1129,
      "dpr": 2,
      "colorDepth": 24
    }
  },
  "api": {
    "secureContext": true,
    "navigatorGpu": true,
    "adapter": {
      "features": [
        "bgra8unorm-storage",
        "clip-distances",
        "core-features-and-limits",
        "depth-clip-control",
        "depth32float-stencil8",
        "float16-renderable",
        "float32-blendable",
        "float32-filterable",
        "float32-renderable",
        "indirect-first-instance",
        "primitive-index",
        "rg11b10ufloat-renderable",
        "shader-f16",
        "texture-compression-astc",
        "texture-compression-astc-sliced-3d",
        "texture-compression-bc",
        "texture-compression-bc-sliced-3d",
        "texture-compression-etc2",
        "texture-formats-tier1",
        "texture-formats-tier2",
        "timestamp-query"
      ],
      "vendor": "apple",
      "architecture": "apple",
      "device": "apple",
      "description": "apple"
    },
    "timestampQuery": true,
    "preferredFormat": "bgra8unorm",
    "configure": {
      "ok": true,
      "error": null
    },
    "getConfiguration": {
      "supported": true,
      "format": "rgba16float",
      "colorSpace": "display-p3",
      "toneMappingMode": "extended",
      "error": null
    },
    "mediaQueries": {
      "dynamicRangeHigh": true,
      "colorGamutP3": true
    },
    "canvas2dFloat16": {
      "supported": false,
      "colorType": null,
      "error": null
    },
    "webgl": {
      "webgl2": true,
      "drawingBufferStorage": false,
      "error": null
    },
    "batteryApi": false
  },
  "edr": {
    "maxDistinctStep": 3,
    "encodingMatch": "nonlinear",
    "refHdrImage": "not_checked",
    "secondsSinceDraw": 11
  },
  "perf": {
    "srcRes": null,
    "canvasRes": null,
    "fps": null,
    "dropRate": null,
    "jsP50": null,
    "jsP95": null,
    "g3": null,
    "visualJudder": null,
    "runs": []
  },
  "flags": {
    "drm": false,
    "hdrSource": false,
    "fullscreen": false
  },
  "vp9Paths": [
    {
      "fixture": "ramp-2160p60.webm",
      "variant": "V-ext",
      "srcRes": "3840x2160",
      "canvasRes": "3600x2025",
      "fullscreen": true,
      "frames": 240,
      "windowSec": 7.97,
      "jsP50": 1,
      "jsP95": 1,
      "jsMax": 5,
      "asyncP50": null,
      "asyncP95": null,
      "displayHz": 60,
      "displayMissRate": 0.49823,
      "loopFps": 29.99,
      "meanBrightness": 0,
      "videoDropped": 0,
      "videoTotal": 494,
      "errorName": null
    },
    {
      "fixture": "ramp-2160p60.webm",
      "variant": "V-copy8",
      "srcRes": "3840x2160",
      "canvasRes": "3600x2025",
      "fullscreen": true,
      "frames": 241,
      "windowSec": 8,
      "jsP50": 13,
      "jsP95": 14,
      "jsMax": 15,
      "asyncP50": null,
      "asyncP95": null,
      "displayHz": 60,
      "displayMissRate": 0.5,
      "loopFps": 30,
      "meanBrightness": 126.76,
      "videoDropped": 0,
      "videoTotal": 535,
      "errorName": null
    },
    {
      "fixture": "ramp-2160p60.webm",
      "variant": "V-copyB",
      "srcRes": "3840x2160",
      "canvasRes": "3600x2025",
      "fullscreen": true,
      "frames": 241,
      "windowSec": 8,
      "jsP50": 20,
      "jsP95": 24,
      "jsMax": 30,
      "asyncP50": null,
      "asyncP95": null,
      "displayHz": 60,
      "displayMissRate": 0.5,
      "loopFps": 30,
      "meanBrightness": 126.77,
      "videoDropped": 0,
      "videoTotal": 518,
      "errorName": null
    },
    {
      "fixture": "ramp-2160p60.webm",
      "variant": "V-bmp",
      "srcRes": "3840x2160",
      "canvasRes": "3600x2025",
      "fullscreen": true,
      "frames": 175,
      "windowSec": 7.92,
      "jsP50": 10,
      "jsP95": 11,
      "jsMax": 15,
      "asyncP50": 40,
      "asyncP95": 43,
      "displayHz": 60,
      "displayMissRate": 0.73557,
      "loopFps": 21.96,
      "meanBrightness": 133.4,
      "videoDropped": 2,
      "videoTotal": 532,
      "errorName": null
    },
    {
      "fixture": "ramp-2160p60.webm",
      "variant": "V-bmpR",
      "srcRes": "3840x2160",
      "canvasRes": "3600x2025",
      "fullscreen": true,
      "frames": 183,
      "windowSec": 7.98,
      "jsP50": 10,
      "jsP95": 10.9,
      "jsMax": 15,
      "asyncP50": 39,
      "asyncP95": 42,
      "displayHz": 60,
      "displayMissRate": 0.75235,
      "loopFps": 22.82,
      "meanBrightness": 133.41,
      "videoDropped": 0,
      "videoTotal": 517,
      "errorName": null
    },
    {
      "fixture": "ramp-2160p60.webm",
      "variant": "V-vf",
      "srcRes": "3840x2160",
      "canvasRes": "3600x2025",
      "fullscreen": true,
      "frames": 241,
      "windowSec": 8,
      "jsP50": 1,
      "jsP95": 2,
      "jsMax": 9,
      "asyncP50": null,
      "asyncP95": null,
      "displayHz": 60,
      "displayMissRate": 0.5,
      "loopFps": 30,
      "meanBrightness": 127.97,
      "videoDropped": 0,
      "videoTotal": 549,
      "errorName": null
    },
    {
      "fixture": "ramp-1080p60.webm",
      "variant": "V-ext",
      "srcRes": "1920x1080",
      "canvasRes": "1920x1080",
      "fullscreen": true,
      "frames": 240,
      "windowSec": 7.97,
      "jsP50": 0,
      "jsP95": 1,
      "jsMax": 2,
      "asyncP50": null,
      "asyncP95": null,
      "displayHz": 60,
      "displayMissRate": 0.49998,
      "loopFps": 30,
      "meanBrightness": 0,
      "videoDropped": 0,
      "videoTotal": 535,
      "errorName": null
    },
    {
      "fixture": "ramp-1080p60.webm",
      "variant": "V-copy8",
      "srcRes": "1920x1080",
      "canvasRes": "1920x1080",
      "fullscreen": true,
      "frames": 241,
      "windowSec": 8,
      "jsP50": 8,
      "jsP95": 11,
      "jsMax": 11,
      "asyncP50": null,
      "asyncP95": null,
      "displayHz": 60,
      "displayMissRate": 0.5,
      "loopFps": 30,
      "meanBrightness": 126.77,
      "videoDropped": 0,
      "videoTotal": 534,
      "errorName": null
    },
    {
      "fixture": "ramp-1080p60.webm",
      "variant": "V-copyB",
      "srcRes": "1920x1080",
      "canvasRes": "1920x1080",
      "fullscreen": true,
      "frames": 241,
      "windowSec": 8,
      "jsP50": 9,
      "jsP95": 10,
      "jsMax": 11,
      "asyncP50": null,
      "asyncP95": null,
      "displayHz": 60,
      "displayMissRate": 0.5,
      "loopFps": 30,
      "meanBrightness": 126.77,
      "videoDropped": 0,
      "videoTotal": 534,
      "errorName": null
    },
    {
      "fixture": "ramp-1080p60.webm",
      "variant": "V-bmp",
      "srcRes": "1920x1080",
      "canvasRes": "1920x1080",
      "fullscreen": true,
      "frames": 241,
      "windowSec": 8,
      "jsP50": 4,
      "jsP95": 5,
      "jsMax": 5,
      "asyncP50": 15,
      "asyncP95": 16,
      "displayHz": 60,
      "displayMissRate": 0.5,
      "loopFps": 30,
      "meanBrightness": 133.39,
      "videoDropped": 0,
      "videoTotal": 504,
      "errorName": null
    },
    {
      "fixture": "ramp-1080p60.webm",
      "variant": "V-bmpR",
      "srcRes": "1920x1080",
      "canvasRes": "1920x1080",
      "fullscreen": true,
      "frames": 241,
      "windowSec": 8,
      "jsP50": 4,
      "jsP95": 5,
      "jsMax": 5,
      "asyncP50": 15,
      "asyncP95": 16,
      "displayHz": 60,
      "displayMissRate": 0.5,
      "loopFps": 30,
      "meanBrightness": 133.39,
      "videoDropped": 0,
      "videoTotal": 549,
      "errorName": null
    },
    {
      "fixture": "ramp-1080p60.webm",
      "variant": "V-vf",
      "srcRes": "1920x1080",
      "canvasRes": "1920x1080",
      "fullscreen": true,
      "frames": 241,
      "windowSec": 8,
      "jsP50": 1,
      "jsP95": 3,
      "jsMax": 5,
      "asyncP50": null,
      "asyncP95": null,
      "displayHz": 60,
      "displayMissRate": 0.5,
      "loopFps": 30,
      "meanBrightness": 127.95,
      "videoDropped": 0,
      "videoTotal": 534,
      "errorName": null
    },
    {
      "fixture": "ramp-2160p60.mp4",
      "variant": "V-ext",
      "srcRes": "3840x2160",
      "canvasRes": "3600x2025",
      "fullscreen": true,
      "frames": 240,
      "windowSec": 7.97,
      "jsP50": 1,
      "jsP95": 2,
      "jsMax": 3,
      "asyncP50": null,
      "asyncP95": null,
      "displayHz": 60,
      "displayMissRate": 0.49998,
      "loopFps": 30,
      "meanBrightness": 128,
      "videoDropped": 0,
      "videoTotal": 490,
      "errorName": null
    },
    {
      "fixture": "ramp-2160p60.mp4",
      "variant": "V-copy8",
      "srcRes": "3840x2160",
      "canvasRes": "3600x2025",
      "fullscreen": true,
      "frames": 240,
      "windowSec": 7.97,
      "jsP50": 14,
      "jsP95": 14,
      "jsMax": 15,
      "asyncP50": null,
      "asyncP95": null,
      "displayHz": 60,
      "displayMissRate": 0.49998,
      "loopFps": 30,
      "meanBrightness": 126.78,
      "videoDropped": 0,
      "videoTotal": 491,
      "errorName": null
    }
  ],
  "errors": []
}